{
  "attempt_id": 22,
  "rung_id": "L06",
  "runner_name": "lane1a_runner.py",
  "runner_output_path": "/Users/eliasflores/Documents/Projects/Apiana_Ai/LLM_Mechanics/Main/Apiana_Papers/river_and_the_canyon/river-and-canyon-repo-FINAL/experiments/2026-06-10_lane-1a-sweep/raw/LANE1A-L06-null-1781149896.json",
  "runner_output_sha256": "f212c260a24804f55b17a45bbcca0483fe90ce06fd3f607d11a947cdb9704149",
  "schema": "lane-1a-sidecar.schema.json",
  "stratum": "null",
  "wrapper_attestation": {
    "artifact_class": "lane-1a-reconnaissance",
    "certification_relevance": "none",
    "context_functional_statement": "Lane 1a uses a lane-specific runner (lane1a_runner.py) that preserves B1 v2-compatible provenance conventions and locked model-loading dependencies, while leaving B1 v2 source unedited. B1 v2's `--manifest` interface requires a Two-Hop L1-specific schema and cannot consume Lane 1a's single-hop key->value nested-dict manifests; per Manager direction (Path A, 2026-06-10), the wrapper subprocesses lane1a_runner.py instead. Lane 1a semantics are wrapper-asserted via the sidecar JSON written alongside each runner output. The runner output bytes are preserved unchanged; the sidecar records the runner output's sha256 so an auditor can verify byte-for-byte preservation. This is not native B1 v2 execution and is not B1 v2.1.",
    "context_is_wrapper_asserted_not_runner_attested": true,
    "lane_1a_context": "lane-1a-reconnaissance"
  },
  "wrapper_invocation_ts": "2026-06-11T03:51:50.772+00:00"
}